{
  "$schema": "../../schemas/contract-type-implementation.schema.json",
  "schema_version": "1.0.0",
  "implementation_id": "ghre-rla-zoho-contracts-draft",
  "contract_type": "Residential Lease Agreement",
  "deployment_status": {
    "state": "draft_only",
    "published": false,
    "attorney_review_required": true,
    "execution_blocked": true,
    "signature_request_sent": false
  },
  "source_manifest_ref": "source-manifest.json",
  "crosswalk_ref": "source-to-clause-crosswalk.json",
  "field_map_ref": "document-field-map.json",
  "template_components_ref": "template-components.json",
  "attachment_requirements_ref": "attachment-requirements.json",
  "reconciliation": {
    "preferred_action": "reuse_existing_contract_type",
    "existing_record_name": "Residential Lease Agreement",
    "duplicate_creation_allowed": false,
    "preserve_prior_published_version": true,
    "edit_executed_agreement_allowed": false,
    "publish_allowed": false
  },
  "clause_records": [
    {
      "code": "RLA-010",
      "path": "src/zoho-contracts/clauses/residential-lease-agreement/rla-010-parties-and-premises.clause.json",
      "clause_name": "RLA-010 — Residential Lease — Parties and Premises",
      "clause_type": "Parties, Premises and Term",
      "clause_title": "1.1. Parties",
      "source_sections": [
        "1.1",
        "1.2"
      ],
      "library_question": "Does this agreement use GH Real Estate as Landlord and the identified dwelling without a nonstandard party or premises structure?",
      "deployment_status": "draft_only_attorney_review_required"
    },
    {
      "code": "RLA-020",
      "path": "src/zoho-contracts/clauses/residential-lease-agreement/rla-020-occupancy-responsibility-and-application-accuracy.clause.json",
      "clause_name": "RLA-020 — Residential Lease — Occupancy, Responsibility, and Application Accuracy",
      "clause_type": "Use, Occupancy and Conduct",
      "clause_title": "1.5. Approved Occupants",
      "source_sections": [
        "1.5",
        "1.6",
        "1.7"
      ],
      "library_question": "Do the named tenants, approved occupants, joint-responsibility terms, and application-information duties match the source facts?",
      "deployment_status": "draft_only_attorney_review_required"
    },
    {
      "code": "RLA-030",
      "path": "src/zoho-contracts/clauses/residential-lease-agreement/rla-030-fair-housing-and-accommodation-requests.clause.json",
      "clause_name": "RLA-030 — Residential Lease — Fair Housing and Accommodation Requests",
      "clause_type": "Compliance and Disclosures",
      "clause_title": "1.8. Fair Housing and Accommodation Requests",
      "source_sections": [
        "1.8"
      ],
      "library_question": "Does the standard fair-housing and individualized accommodation-request process apply without attorney-approved alternate language?",
      "production_gate_ids": [
        "municipality_jurisdiction_applicability"
      ],
      "deployment_status": "draft_only_attorney_review_required"
    },
    {
      "code": "RLA-040",
      "path": "src/zoho-contracts/clauses/residential-lease-agreement/rla-040-lease-term-move-in-and-delay-of-possession.clause.json",
      "clause_name": "RLA-040 — Residential Lease — Lease Term, Move-In, and Delay of Possession",
      "clause_type": "Parties, Premises and Term",
      "clause_title": "2.1. Lease Term",
      "source_sections": [
        "2.1",
        "2.2",
        "2.3"
      ],
      "library_question": "Do the fixed term, move-in conditions, and lawful delay-of-possession remedies apply to this tenancy?",
      "production_gate_ids": [
        "lease_end_time"
      ],
      "deployment_status": "draft_only_attorney_review_required"
    },
    {
      "code": "RLA-050",
      "path": "src/zoho-contracts/clauses/residential-lease-agreement/rla-050-renewal-move-out-notice-and-month-to-month-terms.clause.json",
      "clause_name": "RLA-050 — Residential Lease — Renewal, Move-Out Notice, and Month-to-Month Terms",
      "clause_type": "Parties, Premises and Term",
      "clause_title": "2.4. End of Fixed Term and Month-to-Month Conversion",
      "source_sections": [
        "2.4",
        "2.5",
        "2.6",
        "2.7"
      ],
      "library_question": "Do the standard fixed-term expiration, move-out notice, month-to-month conversion, and renewal rules apply?",
      "deployment_status": "draft_only_attorney_review_required"
    },
    {
      "code": "RLA-060",
      "path": "src/zoho-contracts/clauses/residential-lease-agreement/rla-060-early-termination-and-unauthorized-move-out.clause.json",
      "clause_name": "RLA-060 — Residential Lease — Early Termination and Unauthorized Move-Out",
      "clause_type": "Default, Remedies and Termination",
      "clause_title": "2.8. Tenant Early Termination / Buy-Out",
      "source_sections": [
        "2.8",
        "2.9",
        "2.10"
      ],
      "library_question": "Will any early termination use a signed buy-out or another lawful basis rather than an automatic personal-circumstances release?",
      "deployment_status": "draft_only_attorney_review_required"
    },
    {
      "code": "RLA-070",
      "path": "src/zoho-contracts/clauses/residential-lease-agreement/rla-070-military-protected-person-and-sole-tenant-rights.clause.json",
      "clause_name": "RLA-070 — Residential Lease — Military, Protected-Person, and Sole-Tenant Rights",
      "clause_type": "Default, Remedies and Termination",
      "clause_title": "2.11. Military and Protected-Person Rights",
      "source_sections": [
        "2.11",
        "2.12"
      ],
      "library_question": "Do the mandatory military, protected-person, casualty, and sole-tenant-death protections apply without restriction?",
      "deployment_status": "draft_only_attorney_review_required"
    },
    {
      "code": "RLA-080",
      "path": "src/zoho-contracts/clauses/residential-lease-agreement/rla-080-holdover.clause.json",
      "clause_name": "RLA-080 — Residential Lease — Holdover",
      "clause_type": "Default, Remedies and Termination",
      "clause_title": "2.13. Holdover",
      "source_sections": [
        "2.13"
      ],
      "library_question": "Does the standard Kansas holdover provision apply without a separately signed holdover arrangement?",
      "deployment_status": "draft_only_attorney_review_required"
    },
    {
      "code": "RLA-090",
      "path": "src/zoho-contracts/clauses/residential-lease-agreement/rla-090-base-rent.clause.json",
      "clause_name": "RLA-090 — Residential Lease — Base Rent",
      "clause_type": "Rent, Fees and Payment",
      "clause_title": "3.1. Base Rent",
      "source_sections": [
        "3.1"
      ],
      "library_question": "Does the standard monthly Base Rent due date and receipt deadline apply once the governed rent field is approved?",
      "deployment_status": "draft_only_attorney_review_required"
    },
    {
      "code": "RLA-100",
      "path": "src/zoho-contracts/clauses/residential-lease-agreement/rla-100-payment-methods-and-receipt.clause.json",
      "clause_name": "RLA-100 — Residential Lease — Payment Methods and Receipt",
      "clause_type": "Rent, Fees and Payment",
      "clause_title": "3.3. Approved Payment Methods",
      "source_sections": [
        "3.3",
        "3.4"
      ],
      "library_question": "Do the listed payment methods and provisional electronic-payment timing rules apply?",
      "deployment_status": "draft_only_attorney_review_required"
    },
    {
      "code": "RLA-110",
      "path": "src/zoho-contracts/clauses/residential-lease-agreement/rla-110-late-fees-delinquent-interest-and-returned-payments.clause.json",
      "clause_name": "RLA-110 — Residential Lease — Late Fees, Delinquent Interest, and Returned Payments",
      "clause_type": "Rent, Fees and Payment",
      "clause_title": "3.5. Late Fees",
      "source_sections": [
        "3.5",
        "3.6",
        "3.7"
      ],
      "library_question": "Are the stated late-fee, simple-interest, and returned-payment provisions approved for this lease without an attorney-approved exception?",
      "deployment_status": "draft_only_attorney_review_required"
    },
    {
      "code": "RLA-120",
      "path": "src/zoho-contracts/clauses/residential-lease-agreement/rla-120-application-of-payments-and-other-charges.clause.json",
      "clause_name": "RLA-120 — Residential Lease — Application of Payments and Other Charges",
      "clause_type": "Rent, Fees and Payment",
      "clause_title": "3.8. Application of Payments",
      "source_sections": [
        "3.8",
        "3.9",
        "3.10"
      ],
      "library_question": "Will payments and documented non-rent charges be handled under the stated order and pass-through limits?",
      "deployment_status": "draft_only_attorney_review_required"
    },
    {
      "code": "RLA-130",
      "path": "src/zoho-contracts/clauses/residential-lease-agreement/rla-130-withholding-late-payment-statements-and-credits.clause.json",
      "clause_name": "RLA-130 — Residential Lease — Withholding, Late Payment, Statements, and Credits",
      "clause_type": "Rent, Fees and Payment",
      "clause_title": "3.11. No Withholding or Offset Except as Allowed by Law",
      "source_sections": [
        "3.11",
        "3.12",
        "3.13",
        "3.14"
      ],
      "library_question": "Do the standard non-waiver, statement, hardship, concession, and credit provisions apply?",
      "deployment_status": "draft_only_attorney_review_required"
    },
    {
      "code": "RLA-140",
      "path": "src/zoho-contracts/clauses/residential-lease-agreement/rla-140-partial-month-proration.clause.json",
      "clause_name": "RLA-140 — Residential Lease — Partial-Month Proration",
      "clause_type": "Rent, Fees and Payment",
      "clause_title": "3.15. Partial-Month Proration",
      "source_sections": [
        "3.15"
      ],